{
  "schemaVersion": "0.1.0",
  "implementation": {
    "name": "dotnet",
    "version": "1.0.0-beta.3.1",
    "commit": "1df2b1efdaf8318837e2464ed9ca0c58a25acec2",
    "runtime": "net10.0"
  },
  "protocolTag": "v0.2.0",
  "producedAt": "2026-09-16T01:47:33.446Z",
  "summary": {
    "total": 68,
    "passed": 68,
    "failed": 0,
    "errored": 0,
    "skipped": 0,
    "durationMs": 3265.532
  },
  "results": [
    {
      "id": "gate/substance-hollow-refused",
      "outcome": "pass",
      "durationMs": 950.28
    },
    {
      "id": "gate/substance-zero-field-refused",
      "outcome": "pass",
      "durationMs": 37.031
    },
    {
      "id": "gate/ttl-from-verdict",
      "outcome": "pass",
      "durationMs": 202.077
    },
    {
      "id": "gate/ttl-from-policy-default",
      "outcome": "pass",
      "durationMs": 11.38
    },
    {
      "id": "gate/ttl-from-gate-default",
      "outcome": "pass",
      "durationMs": 12.858
    },
    {
      "id": "gate/standing-order-by-the-book",
      "outcome": "pass",
      "durationMs": 17.267
    },
    {
      "id": "gate/standing-order-threshold-under",
      "outcome": "pass",
      "durationMs": 9.959
    },
    {
      "id": "gate/standing-order-threshold-over",
      "outcome": "pass",
      "durationMs": 17.521
    },
    {
      "id": "gate/standing-order-unbound-input",
      "outcome": "pass",
      "durationMs": 36.285
    },
    {
      "id": "gate/standing-order-bound-input",
      "outcome": "pass",
      "durationMs": 44.158
    },
    {
      "id": "gate/multiparty-blocked",
      "outcome": "pass",
      "durationMs": 17.281
    },
    {
      "id": "gate/referral-blocked",
      "outcome": "pass",
      "durationMs": 10.595
    },
    {
      "id": "gate/coverage-refused-declared",
      "outcome": "pass",
      "durationMs": 12.76
    },
    {
      "id": "gate/update-previous-values",
      "outcome": "pass",
      "durationMs": 12.942
    },
    {
      "id": "gate/create-null-previous-values",
      "outcome": "pass",
      "durationMs": 10.787
    },
    {
      "id": "gate/inference-conversation-and-inferred",
      "outcome": "pass",
      "durationMs": 64.553
    },
    {
      "id": "gate/threshold-without-scorer",
      "outcome": "pass",
      "durationMs": 12.182
    },
    {
      "id": "gate/inference-presence-computed-from-the-utterance",
      "outcome": "pass",
      "durationMs": 29.228
    },
    {
      "id": "gate/inference-port-literal-unconfirmed",
      "outcome": "pass",
      "durationMs": 9.26
    },
    {
      "id": "gate/inference-port-span-fails-the-boundary",
      "outcome": "pass",
      "durationMs": 24.034
    },
    {
      "id": "gate/inference-case-folds-and-the-digest-is-the-utterances",
      "outcome": "pass",
      "durationMs": 22.354
    },
    {
      "id": "gate/inference-empty-value-is-nothing-reported",
      "outcome": "pass",
      "durationMs": 12.186
    },
    {
      "id": "decide/approve",
      "outcome": "pass",
      "durationMs": 107.318
    },
    {
      "id": "decide/reject",
      "outcome": "pass",
      "durationMs": 39.789
    },
    {
      "id": "decide/second-decision-refused",
      "outcome": "pass",
      "durationMs": 45.315
    },
    {
      "id": "decide/expired-amendments-preserved",
      "outcome": "pass",
      "durationMs": 55.389
    },
    {
      "id": "decide/blocked-refused",
      "outcome": "pass",
      "durationMs": 15.475
    },
    {
      "id": "decide/amend-recompute",
      "outcome": "pass",
      "durationMs": 249.712
    },
    {
      "id": "decide/unresolved-identity",
      "outcome": "pass",
      "durationMs": 22.642
    },
    {
      "id": "decide/wrong-tenant",
      "outcome": "pass",
      "durationMs": 19.339
    },
    {
      "id": "decide/authorization-declined",
      "outcome": "pass",
      "durationMs": 22.75
    },
    {
      "id": "decide/relay-member-via-relay",
      "outcome": "pass",
      "durationMs": 32.287
    },
    {
      "id": "decide/relay-without-assertion-refused",
      "outcome": "pass",
      "durationMs": 27.619
    },
    {
      "id": "decide/execution-executed",
      "outcome": "pass",
      "durationMs": 39.49
    },
    {
      "id": "decide/execution-failed",
      "outcome": "pass",
      "durationMs": 36.692
    },
    {
      "id": "decide/execution-on-pending-refused",
      "outcome": "pass",
      "durationMs": 30.185
    },
    {
      "id": "decide/resubmit-prefills",
      "outcome": "pass",
      "durationMs": 62.966
    },
    {
      "id": "decide/executed-only-through-a-report",
      "outcome": "pass",
      "durationMs": 58.832
    },
    {
      "id": "decide/authorization-throws",
      "outcome": "pass",
      "durationMs": 19.513
    },
    {
      "id": "decide/execution-recorded-once",
      "outcome": "pass",
      "durationMs": 44.343
    },
    {
      "id": "decide/execution-second-report-refused",
      "outcome": "pass",
      "durationMs": 41.626
    },
    {
      "id": "sequence-a/approve-round-trip",
      "outcome": "pass",
      "durationMs": 62.289
    },
    {
      "id": "sequence-a/reject-round-trip",
      "outcome": "pass",
      "durationMs": 24.568
    },
    {
      "id": "sequence-a/typed-inputs-on-the-card",
      "outcome": "pass",
      "durationMs": 32.451
    },
    {
      "id": "sequence-a/picker-external-binding",
      "outcome": "pass",
      "durationMs": 19.525
    },
    {
      "id": "sequence-a/mandatory-field-left-empty",
      "outcome": "pass",
      "durationMs": 18.115
    },
    {
      "id": "sequence-a/mandatory-field-reviewer-approves",
      "outcome": "pass",
      "durationMs": 26.88
    },
    {
      "id": "sequence-a/expiry-then-resubmit",
      "outcome": "pass",
      "durationMs": 20.691
    },
    {
      "id": "sequence-a/late-amendments-preserved",
      "outcome": "pass",
      "durationMs": 36.939
    },
    {
      "id": "sequence-a/interleaved-conversations",
      "outcome": "pass",
      "durationMs": 25.137
    },
    {
      "id": "sequence-a/replay-keeps-the-deadline",
      "outcome": "pass",
      "durationMs": 29.679
    },
    {
      "id": "sequence-a/sweep-pages",
      "outcome": "pass",
      "durationMs": 57.344
    },
    {
      "id": "sequence-a/rehydration-order",
      "outcome": "pass",
      "durationMs": 88.002
    },
    {
      "id": "sequence-a/coverage-refused-at-wire-up",
      "outcome": "pass",
      "durationMs": 27.267
    },
    {
      "id": "sequence-a/mandatory-field-empty-blocks-standing-order",
      "outcome": "pass",
      "durationMs": 32.956
    },
    {
      "id": "sequence-a/optional-field-empty-standing-order-fires",
      "outcome": "pass",
      "durationMs": 31.028
    },
    {
      "id": "sequence-c/relay-auto-approve-bound-external",
      "outcome": "pass",
      "durationMs": 20.505
    },
    {
      "id": "sequence-c/relayed-decision-member-via-relay",
      "outcome": "pass",
      "durationMs": 23.047
    },
    {
      "id": "sequence-c/unbound-external-asks-a-person",
      "outcome": "pass",
      "durationMs": 18.362
    },
    {
      "id": "sequence-c/relay-may-not-attest-member",
      "outcome": "pass",
      "durationMs": 27.986
    },
    {
      "id": "sequence-c/relay-decision-other-tenant-not-found",
      "outcome": "pass",
      "durationMs": 23.017
    },
    {
      "id": "canonical/create-shaped",
      "outcome": "pass",
      "durationMs": 16.092
    },
    {
      "id": "canonical/update-shaped",
      "outcome": "pass",
      "durationMs": 3.441
    },
    {
      "id": "canonical/wire-evidence-card-request",
      "outcome": "pass",
      "durationMs": 1.465
    },
    {
      "id": "canonical/wire-evidence-card-request-amended",
      "outcome": "pass",
      "durationMs": 29.956
    },
    {
      "id": "canonical/key-order-stress",
      "outcome": "pass",
      "durationMs": 1.468
    },
    {
      "id": "canonical/number-forms",
      "outcome": "pass",
      "durationMs": 1.501
    },
    {
      "id": "canonical/money-and-escapes",
      "outcome": "pass",
      "durationMs": 1.748
    }
  ]
}
